,approved_at_utc,subreddit,selftext,author_fullname,saved,mod_reason_title,gilded,clicked,title,link_flair_richtext,subreddit_name_prefixed,hidden,pwls,link_flair_css_class,downs,thumbnail_height,top_awarded_type,hide_score,name,quarantine,link_flair_text_color,upvote_ratio,author_flair_background_color,subreddit_type,ups,total_awards_received,media_embed,thumbnail_width,author_flair_template_id,is_original_content,user_reports,secure_media,is_reddit_media_domain,is_meta,category,secure_media_embed,link_flair_text,can_mod_post,score,approved_by,author_premium,thumbnail,edited,author_flair_css_class,author_flair_richtext,gildings,post_hint,content_categories,is_self,mod_note,created,link_flair_type,wls,removed_by_category,banned_by,author_flair_type,domain,allow_live_comments,selftext_html,likes,suggested_sort,banned_at_utc,view_count,archived,no_follow,is_crosspostable,pinned,over_18,preview,all_awardings,awarders,media_only,link_flair_template_id,can_gild,spoiler,locked,author_flair_text,treatment_tags,visited,removed_by,num_reports,distinguished,subreddit_id,mod_reason_by,removal_reason,link_flair_background_color,id,is_robot_indexable,report_reasons,author,discussion_type,num_comments,send_replies,whitelist_status,contest_mode,mod_reports,author_patreon_flair,author_flair_text_color,permalink,parent_whitelist_status,stickied,url,subreddit_subscribers,created_utc,num_crossposts,media,is_video,url_overridden_by_dest,is_gallery,media_metadata,gallery_data,event_start,collections,event_end,event_is_live
0,,boardgames,"**Welcome to /r/boardgames Daily Discussion and Game Recommendations**

This is meant to be a place where you can ask any and all questions relating to the board gaming world: general or specific game recommendations, rule clarifications, definitions of terms/acronyms, and other quick questions that might not warrant their own post. You can see previous versions of this post [here](https://www.reddit.com/r/boardgames/search?q=%22%2Fr%2Fboardgames+Daily+Discussion+and+Game+Recommendations%22&amp;restrict_sr=on&amp;sort=new&amp;t=all). 

If you are seeking game recommendations you will get better responses if you give us enough background to help you. You can use [this template](https://www.reddit.com/r/boardgames/wiki/personalized-game-recommendation-template-no-explainer) to do so. [Here](https://www.reddit.com/r/boardgames/wiki/personalized-game-recommendation-template) is a version with explanations of what we're looking for.  

Help people identify your game suggestions easily by bolding the game names. It's easy! Just surround the game name with two asterisks (\*\*) and it will show up bold. If you reply to any comment that has a game name in **bold** with ""**/u/r2d8 getparentinfo**"", one of our robots will tell you more about the game

Just remember that this is a community full of awesome, helpful people, and feel free to ask your questions whatever they may be. As always, keep it civil and remember what the downvote button is actually for.


Lastly, here are some of the resources available at /r/boardgames:

* If you are new here, be sure to check out our [Community Guidelines](https://www.reddit.com/r/boardgames/wiki/community)
* If you are looking for a game recommendation, make sure to read our [What Should I Get Wiki](https://www.reddit.com/r/boardgames/wiki/wsig)
* If asking people for recommendations is too interactive: [The Automated Recommendations Robot is here for you](https://www.reddit.com/r/boardgames/wiki/wsig#wiki_ask_a_robot_for_a_list_of_recommendations).
* For recommendations that take accessibility concerns into account, check out [MeepleLikeUs](https://meeplelikeus.co.uk/recommender-beta/) and their recommender.
* Also take a look at our [Wiki Index](https://www.reddit.com/r/boardgames/wiki/index) for various other resources and information.
* Any questions about game design can be answered here, but also visit /r/tabletopgamedesign
* Any discussions about the subreddit itself should be contained in /r/metaboardgames

*If you use the boardgamerecommender bot in this thread, please reply to the stickied top comment in order to avoid cluttering up the posts.*

Happy gaming!",t2_6l4z3,False,,0,False,"/r/boardgames Daily Discussion and Game Recommendations (September 13, 2020)","[{'e': 'text', 't': 'Daily Game Recs'}]",r/boardgames,False,6,,0,,,False,t3_irs5vf,False,light,0.67,#d0fffd,public,4,0,{},,326005ee-9cf2-11e8-8b1f-0e8f9a199476,False,[],,False,False,,{},Daily Game Recs,False,4,,True,self,False,,"[{'e': 'text', 't': '🤖'}]",{},self,,True,,1600002066.0,richtext,6,,,richtext,self.boardgames,False,"&lt;!-- SC_OFF --&gt;&lt;div class=""md""&gt;&lt;p&gt;&lt;strong&gt;Welcome to &lt;a href=""/r/boardgames""&gt;/r/boardgames&lt;/a&gt; Daily Discussion and Game Recommendations&lt;/strong&gt;&lt;/p&gt;

&lt;p&gt;This is meant to be a place where you can ask any and all questions relating to the board gaming world: general or specific game recommendations, rule clarifications, definitions of terms/acronyms, and other quick questions that might not warrant their own post. You can see previous versions of this post &lt;a href=""https://www.reddit.com/r/boardgames/search?q=%22%2Fr%2Fboardgames+Daily+Discussion+and+Game+Recommendations%22&amp;amp;restrict_sr=on&amp;amp;sort=new&amp;amp;t=all""&gt;here&lt;/a&gt;. &lt;/p&gt;

&lt;p&gt;If you are seeking game recommendations you will get better responses if you give us enough background to help you. You can use &lt;a href=""https://www.reddit.com/r/boardgames/wiki/personalized-game-recommendation-template-no-explainer""&gt;this template&lt;/a&gt; to do so. &lt;a href=""https://www.reddit.com/r/boardgames/wiki/personalized-game-recommendation-template""&gt;Here&lt;/a&gt; is a version with explanations of what we&amp;#39;re looking for.  &lt;/p&gt;

&lt;p&gt;Help people identify your game suggestions easily by bolding the game names. It&amp;#39;s easy! Just surround the game name with two asterisks (**) and it will show up bold. If you reply to any comment that has a game name in &lt;strong&gt;bold&lt;/strong&gt; with &amp;quot;&lt;strong&gt;&lt;a href=""/u/r2d8""&gt;/u/r2d8&lt;/a&gt; getparentinfo&lt;/strong&gt;&amp;quot;, one of our robots will tell you more about the game&lt;/p&gt;

&lt;p&gt;Just remember that this is a community full of awesome, helpful people, and feel free to ask your questions whatever they may be. As always, keep it civil and remember what the downvote button is actually for.&lt;/p&gt;

&lt;p&gt;Lastly, here are some of the resources available at &lt;a href=""/r/boardgames""&gt;/r/boardgames&lt;/a&gt;:&lt;/p&gt;

&lt;ul&gt;
&lt;li&gt;If you are new here, be sure to check out our &lt;a href=""https://www.reddit.com/r/boardgames/wiki/community""&gt;Community Guidelines&lt;/a&gt;&lt;/li&gt;
&lt;li&gt;If you are looking for a game recommendation, make sure to read our &lt;a href=""https://www.reddit.com/r/boardgames/wiki/wsig""&gt;What Should I Get Wiki&lt;/a&gt;&lt;/li&gt;
&lt;li&gt;If asking people for recommendations is too interactive: &lt;a href=""https://www.reddit.com/r/boardgames/wiki/wsig#wiki_ask_a_robot_for_a_list_of_recommendations""&gt;The Automated Recommendations Robot is here for you&lt;/a&gt;.&lt;/li&gt;
&lt;li&gt;For recommendations that take accessibility concerns into account, check out &lt;a href=""https://meeplelikeus.co.uk/recommender-beta/""&gt;MeepleLikeUs&lt;/a&gt; and their recommender.&lt;/li&gt;
&lt;li&gt;Also take a look at our &lt;a href=""https://www.reddit.com/r/boardgames/wiki/index""&gt;Wiki Index&lt;/a&gt; for various other resources and information.&lt;/li&gt;
&lt;li&gt;Any questions about game design can be answered here, but also visit &lt;a href=""/r/tabletopgamedesign""&gt;/r/tabletopgamedesign&lt;/a&gt;&lt;/li&gt;
&lt;li&gt;Any discussions about the subreddit itself should be contained in &lt;a href=""/r/metaboardgames""&gt;/r/metaboardgames&lt;/a&gt;&lt;/li&gt;
&lt;/ul&gt;

&lt;p&gt;&lt;em&gt;If you use the boardgamerecommender bot in this thread, please reply to the stickied top comment in order to avoid cluttering up the posts.&lt;/em&gt;&lt;/p&gt;

&lt;p&gt;Happy gaming!&lt;/p&gt;
&lt;/div&gt;&lt;!-- SC_ON --&gt;",,new,,,False,False,False,False,False,"{'images': [{'source': {'url': 'https://external-preview.redd.it/7yHEWiJ_vfByWex8mkJVq4vvKRYE0jdAlV3jWkrDfdU.jpg?auto=webp&amp;s=cfde1a677280f105ebb03831eb4784f8daf5a13e', 'width': 1380, 'height': 776}, 'resolutions': [{'url': 'https://external-preview.redd.it/7yHEWiJ_vfByWex8mkJVq4vvKRYE0jdAlV3jWkrDfdU.jpg?width=108&amp;crop=smart&amp;auto=webp&amp;s=085768970d6066a009a60e306c8d0d42754f1300', 'width': 108, 'height': 60}, {'url': 'https://external-preview.redd.it/7yHEWiJ_vfByWex8mkJVq4vvKRYE0jdAlV3jWkrDfdU.jpg?width=216&amp;crop=smart&amp;auto=webp&amp;s=3c71c483d3c6817ccfb8bbaaf0878c83265410ab', 'width': 216, 'height': 121}, {'url': 'https://external-preview.redd.it/7yHEWiJ_vfByWex8mkJVq4vvKRYE0jdAlV3jWkrDfdU.jpg?width=320&amp;crop=smart&amp;auto=webp&amp;s=8b6967883fb911cf8083b4aec359cb93def9b66d', 'width': 320, 'height': 179}, {'url': 'https://external-preview.redd.it/7yHEWiJ_vfByWex8mkJVq4vvKRYE0jdAlV3jWkrDfdU.jpg?width=640&amp;crop=smart&amp;auto=webp&amp;s=b6b4484874cba222dd3c91e39fb7fd3f79364a7c', 'width': 640, 'height': 359}, {'url': 'https://external-preview.redd.it/7yHEWiJ_vfByWex8mkJVq4vvKRYE0jdAlV3jWkrDfdU.jpg?width=960&amp;crop=smart&amp;auto=webp&amp;s=dae55c7bc5ff5568a0d65113aa1972a58aeb91c8', 'width': 960, 'height': 539}, {'url': 'https://external-preview.redd.it/7yHEWiJ_vfByWex8mkJVq4vvKRYE0jdAlV3jWkrDfdU.jpg?width=1080&amp;crop=smart&amp;auto=webp&amp;s=ee4c5a34f6f56f00491c33b6935f9a8abd576318', 'width': 1080, 'height': 607}], 'variants': {}, 'id': 'jGkreZbjJMo-H83aiVQSzuh6t80pUM1vmZmn7EiF7zY'}], 'enabled': False}",[],[],False,01476204-cd40-11e7-a8ba-0e829f432fc8,False,False,False,🤖,[],False,,,moderator,t5_2qmjp,,,#1e63be,irs5vf,True,,AutoModerator,,26,False,all_ads,False,[],False,dark,/r/boardgames/comments/irs5vf/rboardgames_daily_discussion_and_game/,all_ads,True,https://www.reddit.com/r/boardgames/comments/irs5vf/rboardgames_daily_discussion_and_game/,3023331,1599973266.0,1,,False,,,,,,,,
1,,boardgames,,t2_16wy8q,False,,0,False,PAX Online Stream Schedule,"[{'e': 'text', 't': 'Event'}]",r/boardgames,False,6,ama,0,,,False,t3_iqmrt5,False,dark,0.76,,public,32,0,{},,,False,[],,False,False,,{},Event,False,32,,False,default,False,,[],{},,,False,,1599842453.0,richtext,6,,,text,reddit.com,False,,,,,,False,False,False,False,False,,[],[],False,087f9c4c-7860-11e7-93b4-0efa31d99dca,False,False,False,,[],False,,,moderator,t5_2qmjp,,,#ff9999,iqmrt5,True,,bgg-uglywalrus,,9,False,all_ads,False,[],False,,/r/boardgames/comments/iqmrt5/pax_online_stream_schedule/,all_ads,True,https://www.reddit.com/r/boardgames/collection/b21d10df-c34a-4010-9bbc-18d77e229e7d,3023331,1599813653.0,0,,False,https://www.reddit.com/r/boardgames/collection/b21d10df-c34a-4010-9bbc-18d77e229e7d,,,,,,,
2,,boardgames,,t2_cwe3a,False,,0,False,"Found this at Walmart, still waiting on my Kickstarter...",[],r/boardgames,False,6,,0,,,False,t3_irk4ce,False,dark,0.95,,public,969,1,{},,,False,[],,False,False,,{},,False,969,,False,default,False,,[],{},,,False,,1599971313.0,text,6,,,text,reddit.com,True,,,,,,False,False,False,False,False,,"[{'giver_coin_reward': None, 'subreddit_id': None, 'is_new': False, 'days_of_drip_extension': 0, 'coin_price': 150, 'id': 'award_77ba55a2-c33c-4351-ac49-807455a80148', 'penny_donate': None, 'award_sub_type': 'GLOBAL', 'coin_reward': 0, 'icon_url': 'https://i.redd.it/award_images/t5_22cerq/trfv6ems1md41_BlessUp.png', 'days_of_premium': 0, 'tiers_by_required_awardings': None, 'resized_icons': [{'url': 'https://preview.redd.it/award_images/t5_22cerq/trfv6ems1md41_BlessUp.png?width=16&amp;height=16&amp;auto=webp&amp;s=7a2f2b927be72d2b46ebd95bab8c072c3be0fbab', 'width': 16, 'height': 16}, {'url': 'https://preview.redd.it/award_images/t5_22cerq/trfv6ems1md41_BlessUp.png?width=32&amp;height=32&amp;auto=webp&amp;s=6e42b7095bcc331e53202438613aa827addf70c3', 'width': 32, 'height': 32}, {'url': 'https://preview.redd.it/award_images/t5_22cerq/trfv6ems1md41_BlessUp.png?width=48&amp;height=48&amp;auto=webp&amp;s=c740f7ef642fd2042d62c2bcba98734d08dfae6c', 'width': 48, 'height': 48}, {'url': 'https://preview.redd.it/award_images/t5_22cerq/trfv6ems1md41_BlessUp.png?width=64&amp;height=64&amp;auto=webp&amp;s=74e630f1072bb2423034ae48aefa241d834d7186', 'width': 64, 'height': 64}, {'url': 'https://preview.redd.it/award_images/t5_22cerq/trfv6ems1md41_BlessUp.png?width=128&amp;height=128&amp;auto=webp&amp;s=0a89cd8011c8210315ee60441eefd77b973a0c82', 'width': 128, 'height': 128}], 'icon_width': 2048, 'static_icon_width': 2048, 'start_date': None, 'is_enabled': True, 'awardings_required_to_grant_benefits': None, 'description': 'Prayers up for the blessed.', 'end_date': None, 'subreddit_coin_reward': 0, 'count': 1, 'static_icon_height': 2048, 'name': 'Bless Up', 'resized_static_icons': [{'url': 'https://preview.redd.it/award_images/t5_22cerq/trfv6ems1md41_BlessUp.png?width=16&amp;height=16&amp;auto=webp&amp;s=7a2f2b927be72d2b46ebd95bab8c072c3be0fbab', 'width': 16, 'height': 16}, {'url': 'https://preview.redd.it/award_images/t5_22cerq/trfv6ems1md41_BlessUp.png?width=32&amp;height=32&amp;auto=webp&amp;s=6e42b7095bcc331e53202438613aa827addf70c3', 'width': 32, 'height': 32}, {'url': 'https://preview.redd.it/award_images/t5_22cerq/trfv6ems1md41_BlessUp.png?width=48&amp;height=48&amp;auto=webp&amp;s=c740f7ef642fd2042d62c2bcba98734d08dfae6c', 'width': 48, 'height': 48}, {'url': 'https://preview.redd.it/award_images/t5_22cerq/trfv6ems1md41_BlessUp.png?width=64&amp;height=64&amp;auto=webp&amp;s=74e630f1072bb2423034ae48aefa241d834d7186', 'width': 64, 'height': 64}, {'url': 'https://preview.redd.it/award_images/t5_22cerq/trfv6ems1md41_BlessUp.png?width=128&amp;height=128&amp;auto=webp&amp;s=0a89cd8011c8210315ee60441eefd77b973a0c82', 'width': 128, 'height': 128}], 'icon_format': None, 'icon_height': 2048, 'penny_price': None, 'award_type': 'global', 'static_icon_url': 'https://i.redd.it/award_images/t5_22cerq/trfv6ems1md41_BlessUp.png'}]",[],False,,False,False,False,,[],False,,,,t5_2qmjp,,,,irk4ce,True,,jonmcclay,,141,True,all_ads,False,[],False,,/r/boardgames/comments/irk4ce/found_this_at_walmart_still_waiting_on_my/,all_ads,False,https://www.reddit.com/gallery/irk4ce,3023331,1599942513.0,0,,False,https://www.reddit.com/gallery/irk4ce,True,"{'4vwe8mc01sm51': {'status': 'valid', 'e': 'Image', 'm': 'image/jpg', 'p': [{'y': 144, 'x': 108, 'u': 'https://preview.redd.it/4vwe8mc01sm51.jpg?width=108&amp;crop=smart&amp;auto=webp&amp;s=be0955c18c4571ed8d71fdfd8115bc2081cb4d40'}, {'y': 288, 'x': 216, 'u': 'https://preview.redd.it/4vwe8mc01sm51.jpg?width=216&amp;crop=smart&amp;auto=webp&amp;s=13c63717499d612535401aec173d0f95c256211e'}, {'y': 426, 'x': 320, 'u': 'https://preview.redd.it/4vwe8mc01sm51.jpg?width=320&amp;crop=smart&amp;auto=webp&amp;s=a6880c68f7da86467b93c31c6db185d8fb53af76'}, {'y': 853, 'x': 640, 'u': 'https://preview.redd.it/4vwe8mc01sm51.jpg?width=640&amp;crop=smart&amp;auto=webp&amp;s=a5ca46f8ea5c85c6889db235cc0889850a1f9a10'}, {'y': 1280, 'x': 960, 'u': 'https://preview.redd.it/4vwe8mc01sm51.jpg?width=960&amp;crop=smart&amp;auto=webp&amp;s=e0771e3f275c969f79ba8e0d4189ec2f59f3c778'}, {'y': 1440, 'x': 1080, 'u': 'https://preview.redd.it/4vwe8mc01sm51.jpg?width=1080&amp;crop=smart&amp;auto=webp&amp;s=9a98425676894644614ca2f2c190858c70d1d4a9'}], 's': {'y': 4032, 'x': 3024, 'u': 'https://preview.redd.it/4vwe8mc01sm51.jpg?width=3024&amp;format=pjpg&amp;auto=webp&amp;s=1695c64695967a64c2bbc7a7dcae7af3dbe2e335'}, 'id': '4vwe8mc01sm51'}, 'j1yyelc01sm51': {'status': 'valid', 'e': 'Image', 'm': 'image/jpg', 'p': [{'y': 144, 'x': 108, 'u': 'https://preview.redd.it/j1yyelc01sm51.jpg?width=108&amp;crop=smart&amp;auto=webp&amp;s=44dc3aa36441e01710dcaebb213e0b94800a9b40'}, {'y': 288, 'x': 216, 'u': 'https://preview.redd.it/j1yyelc01sm51.jpg?width=216&amp;crop=smart&amp;auto=webp&amp;s=c8b7e2828ca80961de674478a3024386c08e43e9'}, {'y': 426, 'x': 320, 'u': 'https://preview.redd.it/j1yyelc01sm51.jpg?width=320&amp;crop=smart&amp;auto=webp&amp;s=3eec23281327265b562c8bf77bf14c681de90510'}, {'y': 853, 'x': 640, 'u': 'https://preview.redd.it/j1yyelc01sm51.jpg?width=640&amp;crop=smart&amp;auto=webp&amp;s=7ca080449270477912a5cf7f16cba4d09138eb7e'}, {'y': 1280, 'x': 960, 'u': 'https://preview.redd.it/j1yyelc01sm51.jpg?width=960&amp;crop=smart&amp;auto=webp&amp;s=1df61f4b71dfc447e4bbfb353e2f093131922af7'}, {'y': 1440, 'x': 1080, 'u': 'https://preview.redd.it/j1yyelc01sm51.jpg?width=1080&amp;crop=smart&amp;auto=webp&amp;s=1c62f41b7bfd3fd5f791a172c9fb8e0d062318a5'}], 's': {'y': 4032, 'x': 3024, 'u': 'https://preview.redd.it/j1yyelc01sm51.jpg?width=3024&amp;format=pjpg&amp;auto=webp&amp;s=244486f421ab396b6cb2751d36efc73901cb67ca'}, 'id': 'j1yyelc01sm51'}}","{'items': [{'caption': '(I opted for the faster shipping of separate components)', 'media_id': 'j1yyelc01sm51', 'id': 5005686}, {'media_id': '4vwe8mc01sm51', 'id': 5005687}]}",,,,
3,,boardgames,,t2_7a23zanu,False,,0,False,Social Deduction Games in a Nutshell,[],r/boardgames,False,6,,0,105.0,,True,t3_irxdxg,False,dark,0.94,,public,24,0,"{'content': '&lt;iframe width=""600"" height=""338"" src=""https://www.youtube.com/embed/quDGBjHlDyY?feature=oembed&amp;enablejsapi=1"" frameborder=""0"" allow=""accelerometer; autoplay; encrypted-media; gyroscope; picture-in-picture"" allowfullscreen&gt;&lt;/iframe&gt;', 'width': 600, 'scrolling': False, 'height': 338}",140.0,,False,[],"{'type': 'youtube.com', 'oembed': {'provider_url': 'https://www.youtube.com/', 'version': '1.0', 'title': 'Social Deduction Games in a Nutshell', 'type': 'video', 'thumbnail_width': 480, 'height': 338, 'width': 600, 'html': '&lt;iframe width=""600"" height=""338"" src=""https://www.youtube.com/embed/quDGBjHlDyY?feature=oembed&amp;enablejsapi=1"" frameborder=""0"" allow=""accelerometer; autoplay; encrypted-media; gyroscope; picture-in-picture"" allowfullscreen&gt;&lt;/iframe&gt;', 'author_name': 'BoardGameBro', 'provider_name': 'YouTube', 'thumbnail_url': 'https://i.ytimg.com/vi/quDGBjHlDyY/hqdefault.jpg', 'thumbnail_height': 360, 'author_url': 'https://www.youtube.com/user/MrAdoptxaxdrummer'}}",False,False,,"{'content': '&lt;iframe width=""600"" height=""338"" src=""https://www.youtube.com/embed/quDGBjHlDyY?feature=oembed&amp;enablejsapi=1"" frameborder=""0"" allow=""accelerometer; autoplay; encrypted-media; gyroscope; picture-in-picture"" allowfullscreen&gt;&lt;/iframe&gt;', 'width': 600, 'scrolling': False, 'media_domain_url': 'https://www.redditmedia.com/mediaembed/irxdxg', 'height': 338}",,False,24,,False,https://a.thumbs.redditmedia.com/x9GGIk-gvFwRFI0WGBdilEDgnbX9CFFwWCAoinmo5a8.jpg,False,,[],{},rich:video,,False,,1600028927.0,text,6,,,text,youtu.be,False,,,,,,False,False,False,False,False,"{'images': [{'source': {'url': 'https://external-preview.redd.it/2nITudXmh3S2thcVhboqoNN4ETY_3LcuqdfnMSIIT2E.jpg?auto=webp&amp;s=e94031c2761d8e4ef887642ab4cd3407ca348722', 'width': 480, 'height': 360}, 'resolutions': [{'url': 'https://external-preview.redd.it/2nITudXmh3S2thcVhboqoNN4ETY_3LcuqdfnMSIIT2E.jpg?width=108&amp;crop=smart&amp;auto=webp&amp;s=5c54a124da47c8af8e3f0996e300b682a29670ad', 'width': 108, 'height': 81}, {'url': 'https://external-preview.redd.it/2nITudXmh3S2thcVhboqoNN4ETY_3LcuqdfnMSIIT2E.jpg?width=216&amp;crop=smart&amp;auto=webp&amp;s=00d035c7b0244714be0f400c661382a356ca7e20', 'width': 216, 'height': 162}, {'url': 'https://external-preview.redd.it/2nITudXmh3S2thcVhboqoNN4ETY_3LcuqdfnMSIIT2E.jpg?width=320&amp;crop=smart&amp;auto=webp&amp;s=e02a214e213df03fc89625b5398c1d0288bde8da', 'width': 320, 'height': 240}], 'variants': {}, 'id': 'EUEgOBzRjpj7j9McSzkgqxmGb-0GsoW22ok1JT-dOSU'}], 'enabled': False}",[],[],False,,False,False,False,,[],False,,,,t5_2qmjp,,,,irxdxg,True,,BoardGame_Bro,,0,True,all_ads,False,[],False,,/r/boardgames/comments/irxdxg/social_deduction_games_in_a_nutshell/,all_ads,False,https://youtu.be/quDGBjHlDyY,3023331,1600000127.0,0,"{'type': 'youtube.com', 'oembed': {'provider_url': 'https://www.youtube.com/', 'version': '1.0', 'title': 'Social Deduction Games in a Nutshell', 'type': 'video', 'thumbnail_width': 480, 'height': 338, 'width': 600, 'html': '&lt;iframe width=""600"" height=""338"" src=""https://www.youtube.com/embed/quDGBjHlDyY?feature=oembed&amp;enablejsapi=1"" frameborder=""0"" allow=""accelerometer; autoplay; encrypted-media; gyroscope; picture-in-picture"" allowfullscreen&gt;&lt;/iframe&gt;', 'author_name': 'BoardGameBro', 'provider_name': 'YouTube', 'thumbnail_url': 'https://i.ytimg.com/vi/quDGBjHlDyY/hqdefault.jpg', 'thumbnail_height': 360, 'author_url': 'https://www.youtube.com/user/MrAdoptxaxdrummer'}}",False,https://youtu.be/quDGBjHlDyY,,,,,,,
